{
  "knowledgeEntryId": "kno-20260917-prompt-aii-deep-prompt-engineering",
  "sourceProject": "prompt-aii",
  "status": "approved",
  "version": 1,
  "knowledgePath": "knowledge/projects/prompt-aii-deep-prompt-engineering.json",
  "approvedBy": "initial-foundation-review",
  "sanitized": true,
  "catalogVersion": "1.1.0"
}
